{
  "id": "CS_2025_11_05_001",
  "intent": "Fix null handling in AuthService",
  "locks": [
    "src/auth/AuthService.java",
    "src/auth/AuthServiceTest.java"
  ],
  "base_commit": "abc123def4567890abc123def4567890abc123de",
  "diff": "diff --git a/src/auth/AuthService.java b/src/auth/AuthService.java\nindex e69de29..4b825dc 100644\n--- a/src/auth/AuthService.java\n+++ b/src/auth/AuthService.java\n@@ -1,3 +1,7 @@\n+// handle null tokens defensively\n+if (token == null) {\n+    return AuthResult.invalid(\"null token\");\n+}\n",
  "validation_plan": {
    "format": "mvn -q -DskipTests fmt:format || true",
    "build": "mvn -q -DskipTests package",
    "tests": [
      "mvn -q -Dtest=AuthServiceTest test"
    ],
    "static_checks": [
      "mvn -q spotbugs:check"
    ],
    "coverage_min": 0.8
  },
  "impact": {
    "files_changed": 1,
    "symbols": [
      "AuthService.authenticate"
    ]
  }
}